{
  "$schema": "http://json-schema.org/draft-07/schema#",
  "$id": "https://github.com/AV1el/Aviel-Dialogue-Mischiefs/docs/schemas/dialogue.schema.json",
  "title": "ADM Dialogue",
  "description": "A branching dialogue for Aviel's Dialogue Mod. Place in config/adm-dialogues/dialogues/ or data/<ns>/adm_dialogues/dialogues/.",
  "type": "object",
  "properties": {
    "title": { "type": "string", "maxLength": 80, "description": "Window title." },
    "speaker": { "type": "string", "maxLength": 80, "description": "Default speaker name for all nodes." },
    "text_speed": { "type": "integer", "minimum": 0, "maximum": 12, "description": "Default typewriter speed (0 = instant)." },
    "default_text_speed": { "type": "integer", "minimum": 0, "maximum": 12 },
    "text_color": { "$ref": "#/definitions/color" },
    "speaker_color": { "$ref": "#/definitions/color" },
    "start": { "oneOf": [ { "type": "string" }, { "type": "array", "items": { "type": "string" } } ] },
    "starts": { "type": "array", "items": { "type": "string" } },
    "random_start": {
      "type": "array",
      "items": { "type": "string" },
      "description": "Node ids to pick a random start from."
    },
    "sound": { "$ref": "#/definitions/sound" },
    "style": { "$ref": "#/definitions/style" },
    "nodes": {
      "description": "Dialogue nodes as an id-to-node object, or an array of nodes with 'id' fields.",
      "oneOf": [
        { "type": "object", "additionalProperties": { "$ref": "#/definitions/node" } },
        { "type": "array", "items": { "allOf": [ { "$ref": "#/definitions/node" }, { "required": ["id"] } ] } }
      ]
    }
  },
  "required": ["nodes"],
  "definitions": {
    "color": { "type": "string", "maxLength": 16, "pattern": "^$|^[&#].*", "description": "Hex color like #RRGGBB(AA) or & formatting code." },
    "sound": {
      "type": "object",
      "properties": {
        "mode": { "type": "string", "enum": ["none", "off", "full", "repeating", "repeat"] },
        "text": { "type": "string", "description": "Sound played while text types (file from config/adm-dialogues/sounds or resource location)." },
        "text_sound": { "type": "string" },
        "full": { "type": "string", "description": "Voice-over sound played once per node." },
        "full_sound": { "type": "string" },
        "voice": { "type": "string" },
        "volume": { "type": "number", "minimum": 0, "maximum": 4 },
        "pitch": { "type": "number", "minimum": 0.1, "maximum": 4 },
        "letter_interval": { "type": "integer", "minimum": 1, "maximum": 12 }
      }
    },
    "style": {
      "type": "object",
      "properties": {
        "outer_color": { "$ref": "#/definitions/color" },
        "text_background": { "$ref": "#/definitions/color" },
        "choices_background": { "$ref": "#/definitions/color" },
        "divider_color": { "$ref": "#/definitions/color" },
        "button_color": { "$ref": "#/definitions/color" },
        "button_hover_color": { "$ref": "#/definitions/color" },
        "button_disabled_color": { "$ref": "#/definitions/color" },
        "button_text_color": { "$ref": "#/definitions/color" },
        "button_disabled_text_color": { "$ref": "#/definitions/color" },
        "border_color": { "$ref": "#/definitions/color" },
        "header_background": { "$ref": "#/definitions/color" },
        "npc_name_color": { "$ref": "#/definitions/color" },
        "button_border_color": { "$ref": "#/definitions/color" },
        "button_hover_border_color": { "$ref": "#/definitions/color" },
        "button_hover_text_color": { "$ref": "#/definitions/color" },
        "inactive_color": { "$ref": "#/definitions/color" },
        "error_color": { "$ref": "#/definitions/color" },
        "scroll_track_color": { "$ref": "#/definitions/color" },
        "scroll_thumb_color": { "$ref": "#/definitions/color" },
        "typing_indicator_color": { "$ref": "#/definitions/color" }
      }
    },
    "node": {
      "type": "object",
      "properties": {
        "id": { "type": "string", "maxLength": 80 },
        "speaker": { "type": "string", "maxLength": 80 },
        "text": {
          "oneOf": [ { "type": "string" }, { "type": "array", "items": { "type": "string" } } ],
          "description": "Node text. Supports & formatting, {{lang.keys}} and inline tags like <pause:long>, <anim:wave>."
        },
        "text_speed": { "type": "integer", "minimum": 0, "maximum": 12 },
        "speed": { "type": "integer", "minimum": 0, "maximum": 12 },
        "text_color": { "$ref": "#/definitions/color" },
        "speaker_color": { "$ref": "#/definitions/color" },
        "sound": { "$ref": "#/definitions/sound" },
        "choices": { "type": "array", "items": { "$ref": "#/definitions/choice" } }
      }
    },
    "choice": {
      "type": "object",
      "properties": {
        "id": { "type": "string", "maxLength": 80, "description": "Stable id recorded in player choice history." },
        "text": { "type": "string", "maxLength": 140 },
        "label": { "type": "string", "maxLength": 140 },
        "next": { "type": "string", "maxLength": 80, "description": "Target node id." },
        "close": { "type": "boolean" },
        "action": { "type": "string", "enum": ["", "close", "exit", "back"] },
        "trade": { "type": "string", "description": "Trade file or id to open (aliases: shop, open_trade)." },
        "shop": { "type": "string" },
        "open_trade": { "type": "string" },
        "commands": { "type": "array", "items": { "type": "string" }, "description": "Server commands; placeholders {player}, {npc}, {player_uuid}, {npc_uuid}." },
        "command": { "type": "string" },
        "set_flags": { "$ref": "#/definitions/stringList" },
        "add_flags": { "$ref": "#/definitions/stringList" },
        "clear_flags": { "$ref": "#/definitions/stringList" },
        "remove_flags": { "$ref": "#/definitions/stringList" },
        "requires_flags": { "$ref": "#/definitions/stringList" },
        "missing_flags": { "$ref": "#/definitions/stringList" },
        "requires_missing_flags": { "$ref": "#/definitions/stringList" },
        "add_tags": { "$ref": "#/definitions/stringList" },
        "remove_tags": { "$ref": "#/definitions/stringList" },
        "requires_tags": { "$ref": "#/definitions/stringList" },
        "missing_tags": { "$ref": "#/definitions/stringList" },
        "requires_missing_tags": { "$ref": "#/definitions/stringList" },
        "requires_choices": { "$ref": "#/definitions/stringList" },
        "requires_advancements": { "$ref": "#/definitions/stringList" },
        "requires_advancement": { "type": "string" },
        "missing_advancements": { "$ref": "#/definitions/stringList" },
        "missing_advancement": { "type": "string" },
        "requires_kills": { "$ref": "#/definitions/killRules" },
        "requires_kill": { "$ref": "#/definitions/killRule" },
        "condition": { "$ref": "#/definitions/condition" },
        "conditions": {
          "type": "array",
          "items": { "$ref": "#/definitions/condition" },
          "description": "Shorthand for an all-condition group."
        },
        "requires_items": { "$ref": "#/definitions/itemRules" },
        "take_items": { "$ref": "#/definitions/itemRules" },
        "give_items": { "$ref": "#/definitions/itemRules" },
        "opinion_changes": {
          "type": "array",
          "maxItems": 32,
          "items": {
            "type": "object",
            "properties": {
              "scope": { "enum": ["npc", "faction"] },
              "faction": { "type": "string", "pattern": "^[a-z0-9_.:-]{1,80}$" },
              "key": { "type": "string", "pattern": "^[a-z0-9_.:-]{1,80}$" },
              "amount": { "type": "integer", "minimum": -100000, "maximum": 100000 },
              "set": { "type": "integer", "minimum": -100, "maximum": 100 }
            },
            "oneOf": [{ "required": ["amount"] }, { "required": ["set"] }]
          }
        }
      },
      "anyOf": [ { "required": ["text"] }, { "required": ["label"] } ]
    },
    "condition": {
      "oneOf": [
        {
          "type": "array",
          "items": { "$ref": "#/definitions/condition" },
          "maxItems": 64
        },
        {
          "type": "object",
          "properties": {
            "all": {
              "type": "array",
              "items": { "$ref": "#/definitions/condition" },
              "maxItems": 64
            }
          },
          "required": ["all"],
          "additionalProperties": false
        },
        {
          "type": "object",
          "properties": {
            "any": {
              "type": "array",
              "items": { "$ref": "#/definitions/condition" },
              "maxItems": 64
            }
          },
          "required": ["any"],
          "additionalProperties": false
        },
        {
          "type": "object",
          "properties": {
            "not": { "$ref": "#/definitions/condition" }
          },
          "required": ["not"],
          "additionalProperties": false
        },
        {
          "type": "object",
          "properties": {
            "type": {
              "type": "string",
              "pattern": "^[a-z][a-z0-9_.-]{0,63}$",
              "description": "Built-in type or a custom type registered through the Java API."
            },
            "id": { "type": "string" },
            "item": { "type": "string" },
            "entity": { "type": "string" },
            "advancement": { "type": "string" },
            "flag": { "type": "string" },
            "tag": { "type": "string" },
            "dimension": { "type": "string" },
            "biome": { "type": "string" },
            "value": { "type": "string" },
            "mode": { "type": "string" },
            "weather": { "type": "string" },
            "team": { "type": "string" },
            "objective": { "type": "string" },
            "scope": { "enum": ["npc", "faction"] },
            "faction": { "type": "string", "pattern": "^[a-z0-9_.:-]{1,80}$" },
            "key": { "type": "string", "pattern": "^[a-z0-9_.:-]{1,80}$" },
            "count": { "type": "integer", "minimum": 1 },
            "amount": { "type": "number" },
            "min": { "type": "number" },
            "max": { "type": "number" },
            "expected": { "type": "boolean" },
            "done": { "type": "boolean" }
          },
          "required": ["type"]
        }
      ]
    },
    "stringList": { "type": "array", "items": { "type": "string" } },
    "killRules": {
      "oneOf": [
        { "$ref": "#/definitions/killRule" },
        { "type": "array", "items": { "$ref": "#/definitions/killRule" } }
      ]
    },
    "killRule": {
      "oneOf": [
        { "type": "string", "description": "Entity id, count 1." },
        {
          "type": "object",
          "properties": {
            "entity": { "type": "string", "description": "Entity id like minecraft:zombie." },
            "mob": { "type": "string" },
            "id": { "type": "string" },
            "count": { "type": "integer", "minimum": 1 }
          },
          "anyOf": [
            { "required": ["entity"] },
            { "required": ["mob"] },
            { "required": ["id"] }
          ]
        }
      ]
    },
    "itemRules": {
      "oneOf": [
        { "$ref": "#/definitions/itemRule" },
        { "type": "array", "items": { "$ref": "#/definitions/itemRule" } }
      ]
    },
    "itemRule": {
      "oneOf": [
        { "type": "string", "description": "Item id, count 1." },
        {
          "type": "object",
          "properties": {
            "item": { "type": "string", "description": "Item id like minecraft:iron_ingot." },
            "id": { "type": "string" },
            "count": { "type": "integer", "minimum": 1 }
          },
          "anyOf": [ { "required": ["item"] }, { "required": ["id"] } ]
        }
      ]
    }
  }
}
